{
  "generated_at": "2026-09-12T17:20:20-07:00",
  "memberships": [
    {
      "firstObservedAt": "2026-09-12T17:10:41-07:00",
      "lastObservedAt": "2026-09-12T17:20:20-07:00",
      "membershipEvidence": [
        "films_in_this_program_section",
        "child_copy_section"
      ],
      "membershipId": "nwff:program:local-sightings-2026-creature-feature|nwff:short:local-sightings-2026-creature-feature:pepper-s-meal",
      "parsedDescription": "A woman enjoys a contemplative meal alone, as she has before and will again.",
      "parsedDirectors": [
        "Jared Hines"
      ],
      "parsedLanguage": "English",
      "parsedLocationText": "Seattle",
      "parsedRuntimeMin": 4,
      "parsedTitle": "Pepper's Meal",
      "parsedYear": 2025,
      "position": 1,
      "rawDescription": "A woman enjoys a contemplative meal alone, as she has before and will again.",
      "rawMetadataBlock": "(Jared Hines, Seattle, 2025, 4min, in English)",
      "rawTitle": "Pepper's Meal",
      "shortId": "nwff:short:local-sightings-2026-creature-feature:pepper-s-meal",
      "shortsProgramId": "nwff:program:local-sightings-2026-creature-feature",
      "source": "nwff"
    },
    {
      "firstObservedAt": "2026-09-12T17:10:41-07:00",
      "lastObservedAt": "2026-09-12T17:20:20-07:00",
      "membershipEvidence": [
        "films_in_this_program_section",
        "child_copy_section"
      ],
      "membershipId": "nwff:program:local-sightings-2026-creature-feature|nwff:short:local-sightings-2026-creature-feature:look-at-this-freak",
      "parsedDescription": "A reunion of old friends is disrupted by a hated roommate and an internet monstrosity.",
      "parsedDirectors": [
        "Alex Furnas"
      ],
      "parsedLanguage": "English",
      "parsedLocationText": "Seattle",
      "parsedRuntimeMin": 15,
      "parsedTitle": "Look At This Freak",
      "parsedYear": 2025,
      "position": 2,
      "rawDescription": "A reunion of old friends is disrupted by a hated roommate and an internet monstrosity.",
      "rawMetadataBlock": "(Alex Furnas, Seattle, 2025, 15min, in English)",
      "rawTitle": "Look At This Freak",
      "shortId": "nwff:short:local-sightings-2026-creature-feature:look-at-this-freak",
      "shortsProgramId": "nwff:program:local-sightings-2026-creature-feature",
      "source": "nwff"
    },
    {
      "firstObservedAt": "2026-09-12T17:10:41-07:00",
      "lastObservedAt": "2026-09-12T17:20:20-07:00",
      "membershipEvidence": [
        "films_in_this_program_section",
        "child_copy_section"
      ],
      "membershipId": "nwff:program:local-sightings-2026-creature-feature|nwff:short:local-sightings-2026-creature-feature:bellybutton-and-the-monster-goat-of-the-mountain",
      "parsedDescription": "The animated tale of a curious boy, a courageous grandmother, and a fearsome monster goat.",
      "parsedDirectors": [
        "Squidems"
      ],
      "parsedLanguage": "English",
      "parsedLocationText": "Seattle",
      "parsedRuntimeMin": 9,
      "parsedTitle": "Bellybutton and the Monster Goat of the Mountain",
      "parsedYear": 2025,
      "position": 3,
      "rawDescription": "The animated tale of a curious boy, a courageous grandmother, and a fearsome monster goat.",
      "rawMetadataBlock": "(Squidems, Seattle, 2025, 9min, in English)",
      "rawTitle": "Bellybutton and the Monster Goat of the Mountain",
      "shortId": "nwff:short:local-sightings-2026-creature-feature:bellybutton-and-the-monster-goat-of-the-mountain",
      "shortsProgramId": "nwff:program:local-sightings-2026-creature-feature",
      "source": "nwff"
    },
    {
      "firstObservedAt": "2026-09-12T17:10:41-07:00",
      "lastObservedAt": "2026-09-12T17:20:20-07:00",
      "membershipEvidence": [
        "films_in_this_program_section",
        "child_copy_section"
      ],
      "membershipId": "nwff:program:local-sightings-2026-creature-feature|nwff:short:local-sightings-2026-creature-feature:the-astronaut",
      "parsedDescription": "In the 1980s, a lonely UFO enthusiast longing for human connection becomes convinced he has been contacted by extraterrestrial life.",
      "parsedDirectors": [
        "Adam Wells"
      ],
      "parsedLanguage": "English",
      "parsedLocationText": "Renton",
      "parsedRuntimeMin": 11,
      "parsedTitle": "The Astronaut",
      "parsedYear": 2026,
      "position": 4,
      "rawDescription": "In the 1980s, a lonely UFO enthusiast longing for human connection becomes convinced he has been contacted by extraterrestrial life.",
      "rawMetadataBlock": "(Adam Wells, Renton, 2026, 11min, in English)",
      "rawTitle": "The Astronaut",
      "shortId": "nwff:short:local-sightings-2026-creature-feature:the-astronaut",
      "shortsProgramId": "nwff:program:local-sightings-2026-creature-feature",
      "source": "nwff"
    },
    {
      "firstObservedAt": "2026-09-12T17:10:41-07:00",
      "lastObservedAt": "2026-09-12T17:20:20-07:00",
      "membershipEvidence": [
        "films_in_this_program_section",
        "child_copy_section"
      ],
      "membershipId": "nwff:program:local-sightings-2026-creature-feature|nwff:short:local-sightings-2026-creature-feature:best-friend-material",
      "parsedDescription": "A horror comedy about a guys weekend gone wrong.",
      "parsedDirectors": [
        "Mel McCarthy & Nathan Blanchard"
      ],
      "parsedLanguage": "English",
      "parsedLocationText": "Tacoma",
      "parsedRuntimeMin": 15,
      "parsedTitle": "Best Friend Material",
      "parsedYear": 2025,
      "position": 5,
      "rawDescription": "A horror comedy about a guys weekend gone wrong.",
      "rawMetadataBlock": "(Mel McCarthy & Nathan Blanchard, Tacoma, 2025, 15min, in English)",
      "rawTitle": "Best Friend Material",
      "shortId": "nwff:short:local-sightings-2026-creature-feature:best-friend-material",
      "shortsProgramId": "nwff:program:local-sightings-2026-creature-feature",
      "source": "nwff"
    },
    {
      "firstObservedAt": "2026-09-12T17:10:41-07:00",
      "lastObservedAt": "2026-09-12T17:20:20-07:00",
      "membershipEvidence": [
        "films_in_this_program_section",
        "child_copy_section"
      ],
      "membershipId": "nwff:program:local-sightings-2026-creature-feature|nwff:short:local-sightings-2026-creature-feature:diwata",
      "parsedDescription": "After her granddaughter drowns, a secretly-magical Filipina grandmother (“Lola”) hides from the ocean she once loved. Five years later, fed up with her toxic family and 80th birthday, Lola returns to the sea. Using her magic, Lola resurrects her granddaughter, hoping to find herself, too.",
      "parsedDirectors": [
        "Shea Formanes"
      ],
      "parsedLanguage": "English and Tagalog with English Subtitles",
      "parsedLocationText": "Seattle",
      "parsedRuntimeMin": 16,
      "parsedTitle": "Diwata",
      "parsedYear": 2026,
      "position": 6,
      "rawDescription": "After her granddaughter drowns, a secretly-magical Filipina grandmother (“Lola”) hides from the ocean she once loved. Five years later, fed up with her toxic family and 80th birthday, Lola returns to the sea. Using her magic, Lola resurrects her granddaughter, hoping to find herself, too.",
      "rawMetadataBlock": "(Shea Formanes, Seattle, 2026, 16min, in English and Tagalog with English Subtitles)",
      "rawTitle": "Diwata",
      "shortId": "nwff:short:local-sightings-2026-creature-feature:diwata",
      "shortsProgramId": "nwff:program:local-sightings-2026-creature-feature",
      "source": "nwff"
    },
    {
      "firstObservedAt": "2026-09-12T17:10:41-07:00",
      "lastObservedAt": "2026-09-12T17:20:20-07:00",
      "membershipEvidence": [
        "films_in_this_program_section",
        "child_copy_section"
      ],
      "membershipId": "nwff:program:local-sightings-2026-creature-feature|nwff:short:local-sightings-2026-creature-feature:state-rep",
      "parsedDescription": "Oregon State Representative Chad Biche has his sights set on Congress, taking every step to boost his ego, increase his credibility, and take as many selfies as possible. But when presented with the opportunity to make a real difference in the life of one of his constituents, will he have a change of heart?",
      "parsedDirectors": [
        "Eric Kenneth Delehoy"
      ],
      "parsedLanguage": "English",
      "parsedLocationText": "Portland",
      "parsedRuntimeMin": 14,
      "parsedTitle": "State Rep",
      "parsedYear": 2025,
      "position": 7,
      "rawDescription": "Oregon State Representative Chad Biche has his sights set on Congress, taking every step to boost his ego, increase his credibility, and take as many selfies as possible. But when presented with the opportunity to make a real difference in the life of one of his constituents, will he have a change of heart?",
      "rawMetadataBlock": "(Eric Kenneth Delehoy, Portland, 2025, 14min, in English)",
      "rawTitle": "State Rep",
      "shortId": "nwff:short:local-sightings-2026-creature-feature:state-rep",
      "shortsProgramId": "nwff:program:local-sightings-2026-creature-feature",
      "source": "nwff"
    },
    {
      "firstObservedAt": "2026-09-12T17:10:41-07:00",
      "lastObservedAt": "2026-09-12T17:20:20-07:00",
      "membershipEvidence": [
        "films_in_this_program_section",
        "child_copy_section"
      ],
      "membershipId": "nwff:program:local-sightings-2026-lenses-experimental-shorts|nwff:short:local-sightings-2026-lenses-experimental-shorts:charlatans",
      "parsedDescription": "In this abstract music video for Mutual Shock’s “Charlatans,” volatile mixtures of oil, water, and other reactive elements form shifting miniature worlds. Filmed in macro, these unstable chemical landscapes evoke the seduction, distortion, and collapse at the heart of the song.",
      "parsedDirectors": [
        "Tess Martin"
      ],
      "parsedLanguage": "English",